{"route_schema_version": "0.1.0", "route_id": "route-0047", "source_model": "projected-lora", "target_model": "Qwen/Qwen2.5-0.5B", "source_adapter_sha256": "e3b0c44298fc1c149afbf4c8996fb92427ae41e4649b934ca495991b7852b855", "target_model_sha256": "161d7edb4fc13485797b253707ba19d4000b2465062f5c2a40efa17a7bc6e78b", "tenant_id": "tenant-02", "license": "MIT", "projection_method": "JTSA_WDR_CALIBRATED", "calibration": {"forward_passes": 64}, "diagnostics": {"verdict": "PASS", "ppl_degradation": 0, "kl_divergence": 0, "portability_score": 80}, "layers": [{"name": "model.layers.0.self_attn.q_proj.weight", "shape": [896, 896], "dtype": "float16", "delta_sha256": "25a11ec7e7ff11226b21fd98fb66b49f82731cfc425407135962753bfce1a169"}, {"name": "model.layers.1.self_attn.q_proj.weight", "shape": [896, 896], "dtype": "float16", "delta_sha256": "a36f2e23f68436351295f03df195c6b9d90132ef7a5cafbdf938d5008349f1f2"}], "signature": {"algorithm": "hmac-sha256", "key_id": "bench-key", "value": "6d548ed69a3f7d374c5215938c669f5c76387dcd0ab87614cfa56a24c576ba62"}}