{"route_schema_version": "0.1.0", "route_id": "naive", "source_model": "eval-source", "target_model": "Qwen/Qwen2.5-Coder-0.5B-Instruct", "source_adapter_sha256": "1ec5f4127c97618e3329852c96ee636809bd3da77f97a4cde1638881bab56c6a", "target_model_sha256": "a7746fbeaa49b055650af54d1de1110abb2d9ce9fdd79619eb054be88892f117", "tenant_id": "t1", "license": "MIT", "projection_method": "EVAL", "calibration": {"forward_passes": 64}, "diagnostics": {"verdict": "PASS", "ppl_degradation": 0, "kl_divergence": 0, "portability_score": 80}, "payload": {"format": "safetensors", "uri": "payloads\\naive.safetensors", "sha256": "807f8314461202ca87db4c3283a65bdd77ef622b152d2493a03116ac67c77b06"}, "layers": [{"name": "model.layers.0.self_attn.q_proj.weight", "shape": [896, 896], "dtype": "float16", "delta_sha256": "f8791e6582b7a7102922a89163636c5e3ba094e837125fa9d9a6901f71ddae52", "payload_key": "model.layers.0.self_attn.q_proj.weight.delta"}, {"name": "model.layers.0.self_attn.v_proj.weight", "shape": [128, 896], "dtype": "float16", "delta_sha256": "3821004b231f6049cc34f22a52391447c3e4748761bf411dc38d3edb6cee893f", "payload_key": "model.layers.0.self_attn.v_proj.weight.delta"}], "signature": {"algorithm": "hmac-sha256", "key_id": "eval-key", "value": "6ca1a3e0ed66bedc8cd7d0d33460819bad77584e8794c854193b3815a8804b93"}}