{"route_schema_version": "0.1.0", "route_id": "random-lr", "source_model": "eval-source", "target_model": "Qwen/Qwen2.5-Coder-0.5B-Instruct", "source_adapter_sha256": "df288ce3ecc3014aa5a46a40a43bbd416bdd2ad8c1f6e7545021421d9d1089f8", "target_model_sha256": "a7746fbeaa49b055650af54d1de1110abb2d9ce9fdd79619eb054be88892f117", "tenant_id": "t1", "license": "MIT", "projection_method": "EVAL", "calibration": {"forward_passes": 64}, "diagnostics": {"verdict": "PASS", "ppl_degradation": 0, "kl_divergence": 0, "portability_score": 80}, "payload": {"format": "safetensors", "uri": "payloads\\random-lr.safetensors", "sha256": "be8a078cbbf48cc1536059cc16ed39dfe3d7e0172bf1f61096f9832e3fd1def5"}, "layers": [{"name": "model.layers.0.self_attn.q_proj.weight", "shape": [896, 896], "dtype": "float16", "delta_sha256": "5fb0906bcd3336f93c1e21b47231d1a01e34b699d27f3517c48278aabf2124a0", "payload_key": "model.layers.0.self_attn.q_proj.weight.delta"}, {"name": "model.layers.0.self_attn.v_proj.weight", "shape": [128, 896], "dtype": "float16", "delta_sha256": "2e61c6cea0ad715ceb16c6fb3fe5d5e331f65840ae05b0872dd37e8348bb610a", "payload_key": "model.layers.0.self_attn.v_proj.weight.delta"}], "signature": {"algorithm": "hmac-sha256", "key_id": "eval-key", "value": "672d533b7b0138818eb580917f9560d92996abda818a6e29c4a8981130137f65"}}