{"route_schema_version": "0.1.0", "route_id": "projected-jtsa", "source_model": "eval-source", "target_model": "Qwen/Qwen2.5-0.5B", "source_adapter_sha256": "2c207a0e05dae45141cd233a45074121f01161729ce38c1bb4157ae630139933", "target_model_sha256": "161d7edb4fc13485797b253707ba19d4000b2465062f5c2a40efa17a7bc6e78b", "tenant_id": "eval-tenant", "license": "MIT", "projection_method": "EVAL", "calibration": {"forward_passes": 64}, "diagnostics": {"verdict": "PASS", "ppl_degradation": 0, "kl_divergence": 0, "portability_score": 80}, "payload": {"format": "safetensors", "uri": "payloads\\projected-jtsa.safetensors", "sha256": "ac264f19742a6dadcf5f1082bc3f49d0ee257bd5abfce74ad70092bb29563419", "size_bytes": 1835240}, "layers": [{"name": "model.layers.0.self_attn.q_proj.weight", "shape": [896, 896], "dtype": "float16", "delta_sha256": "c0cfcbef8b72463604c811d2b565a0bc8dc6e74c7a8b76089734be926d0fca05", "payload_key": "model.layers.0.self_attn.q_proj.weight.delta"}, {"name": "model.layers.0.self_attn.v_proj.weight", "shape": [128, 896], "dtype": "float16", "delta_sha256": "45d51e3d037f8ca74af29bb4f4181e07e9ef61cb58f9f06e2cbee6a1b4ab7ce9", "payload_key": "model.layers.0.self_attn.v_proj.weight.delta"}], "signature": {"algorithm": "hmac-sha256", "key_id": "eval-key", "value": "ab27aa68cc4dc44e093ffdfc794941dbcc38d8f6eb28013d95ec9cee488afe87"}}