{"route_schema_version": "0.1.0", "route_id": "naive-delta", "source_model": "eval-source", "target_model": "Qwen/Qwen2.5-0.5B", "source_adapter_sha256": "12a7e6f738a2d5f2b22d9948d57eb9860f476c10f2380f7102a7d716e85f9ad6", "target_model_sha256": "161d7edb4fc13485797b253707ba19d4000b2465062f5c2a40efa17a7bc6e78b", "tenant_id": "eval-tenant", "license": "MIT", "projection_method": "EVAL", "calibration": {"forward_passes": 64}, "diagnostics": {"verdict": "PASS", "ppl_degradation": 0, "kl_divergence": 0, "portability_score": 80}, "payload": {"format": "safetensors", "uri": "payloads\\naive-delta.safetensors", "sha256": "175b969e04eef4047edc1d5728dde4ad40f3ca5a28a54ceab6c43f9ed7884563", "size_bytes": 1835240}, "layers": [{"name": "model.layers.0.self_attn.q_proj.weight", "shape": [896, 896], "dtype": "float16", "delta_sha256": "0f59bf54bddf0f44a66aa75ba6df0fa234a1131382784584fa476ad1e6176e9c", "payload_key": "model.layers.0.self_attn.q_proj.weight.delta"}, {"name": "model.layers.0.self_attn.v_proj.weight", "shape": [128, 896], "dtype": "float16", "delta_sha256": "84690a66fb43550ee25dae1f3810c1ecdd3129ff202349a45e963937bd5b7e01", "payload_key": "model.layers.0.self_attn.v_proj.weight.delta"}], "signature": {"algorithm": "hmac-sha256", "key_id": "eval-key", "value": "2fe13a010ee76800c0bca2fde099ffba2f996da9d80c1da6cc127194c087804f"}}