{"route_schema_version": "0.1.0", "route_id": "lora-route-001", "source_model": "projected-lora", "target_model": "Qwen/Qwen2.5-0.5B", "source_adapter_sha256": "50801667895e21199f79d97c209ff4103908557eccdbb847f7109505ccc0f7f5", "target_model_sha256": "161d7edb4fc13485797b253707ba19d4000b2465062f5c2a40efa17a7bc6e78b", "tenant_id": "tenant-01", "license": "MIT", "projection_method": "JTSA_WDR_CALIBRATED", "calibration": {"forward_passes": 64}, "diagnostics": {"verdict": "PASS", "ppl_degradation": 0, "kl_divergence": 0, "portability_score": 85}, "payload": {"format": "safetensors", "uri": "payloads\\lora-route-001.safetensors", "sha256": "dc4c3763bced031cfeac6e8f234bb8801a259f56b5d0f32ccee50e43d96a6501", "size_bytes": 3670480}, "layers": [{"name": "model.layers.0.self_attn.q_proj.weight", "shape": [896, 896], "dtype": "float16", "delta_sha256": "6c32788380bd14a11c48ed5db0c21f0d75f305e2c42c1081d52c31706f99a635", "payload_key": "model.layers.0.self_attn.q_proj.weight.delta"}, {"name": "model.layers.0.self_attn.v_proj.weight", "shape": [128, 896], "dtype": "float16", "delta_sha256": "fe3b8485227ff12149c38b8bb792d40074c735f2ffcc09f79d0e8237fc7c1d26", "payload_key": "model.layers.0.self_attn.v_proj.weight.delta"}, {"name": "model.layers.12.self_attn.q_proj.weight", "shape": [896, 896], "dtype": "float16", "delta_sha256": "2fb524442c212f2613059157156515a9b0e0bfee35465b196e8ae6e1c7313136", "payload_key": "model.layers.12.self_attn.q_proj.weight.delta"}, {"name": "model.layers.12.self_attn.v_proj.weight", "shape": [128, 896], "dtype": "float16", "delta_sha256": "d5afff0873cc9361c2400b32faa7c78af3e2d96c3612d38672f9e65af728f695", "payload_key": "model.layers.12.self_attn.v_proj.weight.delta"}], "signature": {"algorithm": "hmac-sha256", "key_id": "payload-key", "value": "b7a310670f67244da74aefd0a617a53a2930094a4298977b13e636e4d0486569"}}