{"route_schema_version": "0.1.0", "route_id": "real-bench-route", "source_model": "llama-3", "target_model": "tiny-qwen", "source_adapter_sha256": "bbbbbbbbbbbbbbbbbbbbbbbbbbbbbbbbbbbbbbbbbbbbbbbbbbbbbbbbbbbbbbbb", "target_model_sha256": "aaaaaaaaaaaaaaaaaaaaaaaaaaaaaaaaaaaaaaaaaaaaaaaaaaaaaaaaaaaaaaaa", "tenant_id": "bench-tenant", "license": "MIT", "projection_method": "JTSA_WDR_CALIBRATED", "calibration": {"forward_passes": 64}, "diagnostics": {"verdict": "PASS", "ppl_degradation": 0.05, "kl_divergence": 0.01, "portability_score": 95}, "layers": [{"name": "layers.0.self_attn.q_proj.weight", "shape": [256, 256], "dtype": "float32", "delta_sha256": "cccccccccccccccccccccccccccccccccccccccccccccccccccccccccccccccc"}, {"name": "layers.1.self_attn.q_proj.weight", "shape": [256, 256], "dtype": "float32", "delta_sha256": "dddddddddddddddddddddddddddddddddddddddddddddddddddddddddddddddd"}], "signature": {"algorithm": "hmac-sha256", "key_id": "bench-key", "value": "7d5d96a5f899de0e77aa6a1a4723eb58adac0c85b187fc4c5d525b9dd7838c5c"}}