{"route_schema_version": "0.1.0", "route_id": "llama3-coding-to-qwen25-001", "source_model": "meta-llama/Meta-Llama-3-8B", "target_model": "Qwen/Qwen2.5-0.5B-Instruct", "source_adapter_sha256": "e3b0c44298fc1c149afbf4c8996fb92427ae41e4649b934ca495991b7852b855", "target_model_sha256": "8b1a9953c4611296a827abf8c47804d7e4cf39d88532ee43640243e86ac58e77", "tenant_id": "tenant-xyz", "license": "MIT", "projection_method": "JTSA_WDR_CALIBRATED", "calibration": {"forward_passes": 64, "dataset_hash": "a1b2c3d4e5f6"}, "diagnostics": {"verdict": "CAUTION", "ppl_degradation": 0.0006, "kl_divergence": 0.0184, "portability_score": 67}, "layers": [{"name": "model.layers.0.self_attn.q_proj.weight", "shape": [1024, 1024], "dtype": "float16", "delta_sha256": "d4e5f6a1b2c3d4e5f6a1b2c3d4e5f6a1d4e5f6a1b2c3d4e5f6a1b2c3d4e5f6a1"}, {"name": "model.layers.0.self_attn.k_proj.weight", "shape": [256, 1024], "dtype": "float16", "delta_sha256": "f6a1b2c3d4e5f6a1b2c3d4e5f6a1b2c3f6a1b2c3d4e5f6a1b2c3d4e5f6a1b2c3"}], "signature": {"algorithm": "hmac-sha256", "key_id": "dev-key-01", "value": "ed78b27a08004a119d0a456893a55d4afad8da25b92569fa25be5e8eaff2fb13"}}