{"route_schema_version": "0.1.0", "route_id": "lora-route-000", "source_model": "projected-lora", "target_model": "Qwen/Qwen2.5-0.5B", "source_adapter_sha256": "ed73d1bf0e96f6b6df4bdba0fd915c5223afce223db8cfe26f63eaba3a15d03e", "target_model_sha256": "161d7edb4fc13485797b253707ba19d4000b2465062f5c2a40efa17a7bc6e78b", "tenant_id": "tenant-00", "license": "MIT", "projection_method": "JTSA_WDR_CALIBRATED", "calibration": {"forward_passes": 64}, "diagnostics": {"verdict": "PASS", "ppl_degradation": 0, "kl_divergence": 0, "portability_score": 85}, "payload": {"format": "safetensors", "uri": "payloads\\lora-route-000.safetensors", "sha256": "458dcb441d58dae10a24551d5df23e3ccd44a2fffcf1244e979d6c9b599b84fa", "size_bytes": 3670480}, "layers": [{"name": "model.layers.0.self_attn.q_proj.weight", "shape": [896, 896], "dtype": "float16", "delta_sha256": "ab6144f70d4a95843305504d3cf32c7c2a42dcd5d5e8f6e2a6b305d68617ddb8", "payload_key": "model.layers.0.self_attn.q_proj.weight.delta"}, {"name": "model.layers.0.self_attn.v_proj.weight", "shape": [128, 896], "dtype": "float16", "delta_sha256": "2555509a8f77398dd503fce0783e0e5432479a02b0286875108e65639cc93ed1", "payload_key": "model.layers.0.self_attn.v_proj.weight.delta"}, {"name": "model.layers.12.self_attn.q_proj.weight", "shape": [896, 896], "dtype": "float16", "delta_sha256": "5d4638ebfe23f71efa7d047225769206399b0bae89249a46bf995c1feedffa5c", "payload_key": "model.layers.12.self_attn.q_proj.weight.delta"}, {"name": "model.layers.12.self_attn.v_proj.weight", "shape": [128, 896], "dtype": "float16", "delta_sha256": "b9fa3d068727dca691bbe24f8b0edfa6ef9cf6c30a38a6b3176b9cff6cf4ca46", "payload_key": "model.layers.12.self_attn.v_proj.weight.delta"}], "signature": {"algorithm": "hmac-sha256", "key_id": "payload-key", "value": "5601b3fb1da82d2defb18086080be6f30505c2afb82732d6d104c969fee83031"}}