{"route_schema_version": "0.1.0", "route_id": "eval-route", "source_model": "model-a", "target_model": "model-b", "source_adapter_sha256": "bbbbbbbbbbbbbbbbbbbbbbbbbbbbbbbbbbbbbbbbbbbbbbbbbbbbbbbbbbbbbbbb", "target_model_sha256": "aaaaaaaaaaaaaaaaaaaaaaaaaaaaaaaaaaaaaaaaaaaaaaaaaaaaaaaaaaaaaaaa", "tenant_id": "eval-tenant", "license": "MIT", "projection_method": "JTSA_WDR", "calibration": {"forward_passes": 64}, "diagnostics": {"verdict": "PASS", "ppl_degradation": 0, "kl_divergence": 0, "portability_score": 100}, "layers": [{"name": "proj.weight", "shape": [128, 128], "dtype": "float32", "delta_sha256": "cccccccccccccccccccccccccccccccccccccccccccccccccccccccccccccccc"}], "signature": {"algorithm": "hmac-sha256", "key_id": "eval-key", "value": "cad395a556790bd227eeef2d3e9265db86d3895e6793f431d14b8e4d5952f0f4"}}