{"route_schema_version": "0.1.0", "route_id": "stress-route-A", "source_model": "dummy", "target_model": "dummy", "source_adapter_sha256": "e3b0c44298fc1c149afbf4c8996fb92427ae41e4649b934ca495991b7852b855", "target_model_sha256": "8b1a9953c4611296a827abf8c47804d7e4cf39d88532ee43640243e86ac58e77", "tenant_id": "stress-tenant", "license": "MIT", "projection_method": "DUMMY", "calibration": {"forward_passes": 64}, "diagnostics": {"verdict": "PASS", "ppl_degradation": 0, "kl_divergence": 0, "portability_score": 100}, "layers": [{"name": "layer_x", "shape": [10, 10], "dtype": "float32", "delta_sha256": "aaaaaaaaaaaaaaaaaaaaaaaaaaaaaaaaaaaaaaaaaaaaaaaaaaaaaaaaaaaaaaaa"}], "signature": {"algorithm": "hmac-sha256", "key_id": "stress-key", "value": "0ef89d7f3a4db65bf2fc83c53aa9fe30c892a9db169128bb01c116ebf98aa1a5"}}