{"route_schema_version": "0.1.0", "route_id": "lora-route-002", "source_model": "projected-lora", "target_model": "Qwen/Qwen2.5-0.5B", "source_adapter_sha256": "8c8a56688920221fe25491aaa618991b85a9dc3a0e450a40714f8f38bded6bae", "target_model_sha256": "161d7edb4fc13485797b253707ba19d4000b2465062f5c2a40efa17a7bc6e78b", "tenant_id": "tenant-02", "license": "MIT", "projection_method": "JTSA_WDR_CALIBRATED", "calibration": {"forward_passes": 64}, "diagnostics": {"verdict": "PASS", "ppl_degradation": 0, "kl_divergence": 0, "portability_score": 85}, "payload": {"format": "safetensors", "uri": "payloads\\lora-route-002.safetensors", "sha256": "5fc7ccd0d8fb62a8e9acf79b97c15322f0ddc495b7c37f57c0d7922d6e2521fd", "size_bytes": 3670480}, "layers": [{"name": "model.layers.0.self_attn.q_proj.weight", "shape": [896, 896], "dtype": "float16", "delta_sha256": "0dfea16e07abb7edc53881e89e919f1b93a6a1c504eeca445f2fcff48860da32", "payload_key": "model.layers.0.self_attn.q_proj.weight.delta"}, {"name": "model.layers.0.self_attn.v_proj.weight", "shape": [128, 896], "dtype": "float16", "delta_sha256": "41d3fb7d31045a17a7947170179a6cb207f44394a3e8820366d423b8608889b0", "payload_key": "model.layers.0.self_attn.v_proj.weight.delta"}, {"name": "model.layers.12.self_attn.q_proj.weight", "shape": [896, 896], "dtype": "float16", "delta_sha256": "d421d034704a3d1cb140686ec1a3284532639fc18f869f2910fc1e9ac8c8c0aa", "payload_key": "model.layers.12.self_attn.q_proj.weight.delta"}, {"name": "model.layers.12.self_attn.v_proj.weight", "shape": [128, 896], "dtype": "float16", "delta_sha256": "b26de9922587080e5a60dc177668f748d743ec26cd75fd55cc9735420439fd4c", "payload_key": "model.layers.12.self_attn.v_proj.weight.delta"}], "signature": {"algorithm": "hmac-sha256", "key_id": "payload-key", "value": "c3532b9aeb6b6c5e98ce47f8f1b38bf0f8656ed9b66faf5f8c8baf0bd8c67361"}}